### ISSUE TITLE
get on wifi and talk to mqtt broker

### ISSUE THREAD

**Issue by dankamongmen** [dankamongmen/dankdryer#16]
we don't currently get on the wifi. do so. it ought be done in the main loop, not `setup()`, because we'll need to reconnect. once that's done, add mqtt connection (and reconnection). necessary for #15 and #14. give feedback via the LED.

**Comment by dankamongmen** [comment]
https://docs.espressif.com/projects/esp-idf/en/stable/esp32s3/api-guides/wifi.html#esp32-s3-wi-fi-station-general-scenario

**Comment by dankamongmen** [comment]
let's do it without some intermediary library. Espressif ships their own MQTT client now, so we oughtn't need worry about deps in that stack.

**Comment by dankamongmen** [comment]
i'm pretty certain our continuing issues are due to using the arduino-style project and build. let me try building one of their examples using `arduino-cli` and see what happens...

**Comment by dankamongmen** [comment]
nope, i was able to build the esp-idf STA example and it connected to my wifi just fine, and pulled down an IP. hrmm...

**Comment by dankamongmen** [comment]
ahhh, looks like we needed `esp_netif_create_default_wifi_sta()`. with that call, we properly pull a DHCP lease. alright, excellent.

**Comment by dankamongmen** [comment]
yep, with that we are connecting to MQTT and broadcasting mDNS!

```
E..:....@.H...X...X....5.&.k.............mqtt.orthanc.....
19:05:52.609735 IP 192.168.88.1.53 > 192.168.88.165.59396: 48591* 1/0/0 A 192.168.88.1 (46)
E..J..@.@.U	..X...X..5...67..............mqtt.orthanc...................X.
19:05:52.685910 IP 192.168.88.165.60678 > 192.168.88.1.1883: Flags [S], seq 2910239765, win 5760, options [mss 1436], length 0
E..,....@.H...X...X....[.v......`............f
19:05:52.685935 IP 192.168.88.1.1883 > 192.168.88.165.60678: Flags [S.], seq 3594378784, ack 2910239766, win 64240, options [mss 1460], length 0
E..,..@.@.....X...X..[...=. .v..`...X.......
19:05:52.772859 IP 192.168.88.165.60678 > 192.168.88.1.1883: Flags [.], ack 1, win 5760, length 0
E..(....@.H...X...X....[.v...=.!P...U......>.J
19:05:52.772860 IP 192.168.88.165.60678 > 192.168.88.1.1883: Flags [P.], seq 1:41, ack 1, win 5760, length 40
E..P....@.H...X...X....[.v...=.!P....O...&..MQTT...x..ESP32_e1BE34..mora3..mora3
19:05:52.772902 IP 192.168.88.1.1883 > 192.168.88.165.60678: Flags [.], ack 41, win 64200, length 0
E..(i.@.@.....X...X..[...=.!.v.>P...p...
19:05:52.773098 IP 192.168.88.1.1883 > 192.168.88.165.49560: Flags [F.], seq 2903896275, ack 652620666, win 64196, length 0
E..(.;@.@.K...X...X..[......&.3zP.......
19:05:52.773113 IP 192.168.88.1.1883 > 192.168.88.165.60678: Flags [P.], seq 1:5, ack 41, win 64200, length 4
E..,i.@.@.....X...X..[...=.!.v.>P...P... ...
19:05:52.795505 IP 192.168.88.165.49560 > 192.168.88.1.1883: Flags [R.], seq 1, ack 1, win 32790, length 0
E..(....@.H...X...X....[&.3z....P...<.....M..z
19:05:52.868692 IP 192.168.88.165.5353 > 224.0.0.251.5353: 0 [3q] [2n] ANY (QU)? Higher Dryer webserver._http._tcp.local. ANY (QU)? dankdryer0.0.1.local. ANY (QU)? dankdryer0.0.1.local. (120)
E....	........X............z.............Higher Dryer webserver._http._tcp.local......dankdryer0.0.1.......9.......!.....x.......P.9.9.......x....X.
19:05:52.875880 IP 192.168.88.165.60678 > 192.168.88.1.1883: Flags [.], ack 5, win 5756, length 0
E..(.
..@.H...X...X....[.v.>.=.%P..|T.....k#..
19:05:53.167950 IP 192.168.88.165.5353 > 224.0.0.251.5353: 0 [3q] [2n] ANY (QM)? Higher Dryer webserver._http._tcp.local. ANY (QM)? dankdryer0.0.1.local. ANY (QM)? dankdryer0.0.1.local. (120)
```
